{
  "schema_version": "1.0",
  "request_id": "example-game-dry-run-0001",
  "product_type": "GAME",
  "source_factory": "AI-Game-Factory",
  "source_repository": "shihuiarenjinba-png/AI-Game-Factory",
  "source_branch": "codex/factory-autoloop-20261026",
  "source_sha": "aaaaaaaaaaaaaaaaaaaaaaaaaaaaaaaaaaaaaaaa",
  "slug": "example-windows-game",
  "display_name": "Example Windows Game",
  "target_owner": "shihuiarenjinba-png",
  "dry_run": true,
  "requested_actions": ["BUILD_WINDOWS", "INSPECT_PACKAGE", "LOOKUP_OFFICIAL_IDENTITY", "PROPOSE_GITHUB_RETURN"]
}
